{
  "schemaVersion": 2,
  "id": "3e9b1f4a-2c6d-4e8f-9a0b-1c2d3e4f5a6b",
  "source": {
    "type": "github-pull-request-comment",
    "id": "4012345678",
    "url": "https://github.com/JamieGeddes/factorial/pull/87#issuecomment-4012345678"
  },
  "repository": {
    "provider": "github",
    "owner": "JamieGeddes",
    "name": "factorial"
  },
  "inReplyTo": {
    "kind": "pull-request",
    "number": 87
  },
  "title": "Comment on #87: Add retries to the invoker",
  "body": "please rename `retryCount` to `attempts`",
  "requestedBy": "JamieGeddes",
  "createdAt": "2026-10-27T09:15:00Z"
}
