{
  "schemaVersion": 2,
  "id": "7f3c1d2e-5b7a-4c7e-9a1b-2d3e4f5a6b7c",
  "source": {
    "type": "github-issue",
    "id": "1",
    "url": "https://github.com/JamieGeddes/factorial/issues/1"
  },
  "repository": {
    "provider": "github",
    "owner": "JamieGeddes",
    "name": "factorial"
  },
  "title": "Fix typo in README",
  "body": "The word \"recieve\" in README.md should be \"receive\".",
  "requestedBy": "JamieGeddes",
  "createdAt": "2026-10-16T21:30:00Z"
}
